{
  "backbone": {
    "license": "Apache-2.0",
    "repository": "bowphs/GreBerta",
    "revision": "3dce05464f1f429d68acd9b09e117632490c92d4",
    "revision_type": "git-commit",
    "tokenizer_revision": "3dce05464f1f429d68acd9b09e117632490c92d4"
  },
  "corpora": [
    {
      "commit": "bc6f06fae0a2a41de5e65a25b80bef1dc1549f04",
      "name": "pyaegean-a17-reproducibility-fixture",
      "repository": "https://github.com/ryanpavlicek/pyaegean.git"
    }
  ],
  "datasets": [
    {
      "bytes": 107,
      "path": "training/fixtures/a17-dry-run.jsonl",
      "sha256": "7442ea2556317e7b54819a342f6c7da5305b9c65b535e603e4561173f8386aba"
    }
  ],
  "environment": {
    "dependency_inventory_complete": true,
    "dependency_scope": "training-dependency-closure",
    "lock": {
      "bytes": 6404,
      "path": "training/results/a17-environment/environment-lock.json",
      "sha256": "ad9f82deed37b555effea0c999dfb17133eaa539ae4ba86939e86f2699c208ce"
    },
    "lock_sha256": "df5e93dafa345bc53feeb4e0bd2abdbf3397b2cd88156ff29ad25fe174e10135",
    "packages": [
      {
        "name": "accelerate",
        "version": "1.12.0"
      },
      {
        "name": "certifi",
        "version": "2026.6.17"
      },
      {
        "name": "charset-normalizer",
        "version": "3.4.9"
      },
      {
        "name": "filelock",
        "version": "3.29.7"
      },
      {
        "name": "flatbuffers",
        "version": "25.12.19"
      },
      {
        "name": "fsspec",
        "version": "2026.6.0"
      },
      {
        "name": "hf-xet",
        "version": "1.5.1"
      },
      {
        "name": "huggingface-hub",
        "version": "0.36.2"
      },
      {
        "name": "idna",
        "version": "3.18"
      },
      {
        "name": "jinja2",
        "version": "3.1.6"
      },
      {
        "name": "markupsafe",
        "version": "3.0.3"
      },
      {
        "name": "ml-dtypes",
        "version": "0.5.4"
      },
      {
        "name": "mpmath",
        "version": "1.3.0"
      },
      {
        "name": "networkx",
        "version": "3.6.1"
      },
      {
        "name": "numpy",
        "version": "2.3.5"
      },
      {
        "name": "nvidia-cublas-cu12",
        "version": "12.8.4.1"
      },
      {
        "name": "nvidia-cuda-cupti-cu12",
        "version": "12.8.90"
      },
      {
        "name": "nvidia-cuda-nvrtc-cu12",
        "version": "12.8.93"
      },
      {
        "name": "nvidia-cuda-runtime-cu12",
        "version": "12.8.90"
      },
      {
        "name": "nvidia-cudnn-cu12",
        "version": "9.10.2.21"
      },
      {
        "name": "nvidia-cufft-cu12",
        "version": "11.3.3.83"
      },
      {
        "name": "nvidia-cufile-cu12",
        "version": "1.13.1.3"
      },
      {
        "name": "nvidia-curand-cu12",
        "version": "10.3.9.90"
      },
      {
        "name": "nvidia-cusolver-cu12",
        "version": "11.7.3.90"
      },
      {
        "name": "nvidia-cusparse-cu12",
        "version": "12.5.8.93"
      },
      {
        "name": "nvidia-cusparselt-cu12",
        "version": "0.7.1"
      },
      {
        "name": "nvidia-nccl-cu12",
        "version": "2.27.5"
      },
      {
        "name": "nvidia-nvjitlink-cu12",
        "version": "12.8.93"
      },
      {
        "name": "nvidia-nvshmem-cu12",
        "version": "3.3.20"
      },
      {
        "name": "nvidia-nvtx-cu12",
        "version": "12.8.90"
      },
      {
        "name": "onnx",
        "version": "1.20.1"
      },
      {
        "name": "onnxruntime-gpu",
        "version": "1.25.1"
      },
      {
        "name": "packaging",
        "version": "26.2"
      },
      {
        "name": "protobuf",
        "version": "7.35.1"
      },
      {
        "name": "psutil",
        "version": "7.2.2"
      },
      {
        "name": "pyyaml",
        "version": "6.0.3"
      },
      {
        "name": "regex",
        "version": "2026.7.10"
      },
      {
        "name": "requests",
        "version": "2.34.2"
      },
      {
        "name": "safetensors",
        "version": "0.7.0"
      },
      {
        "name": "setuptools",
        "version": "83.0.0"
      },
      {
        "name": "sympy",
        "version": "1.14.0"
      },
      {
        "name": "tokenizers",
        "version": "0.22.2"
      },
      {
        "name": "torch",
        "version": "2.9.1+cu128"
      },
      {
        "name": "tqdm",
        "version": "4.68.4"
      },
      {
        "name": "transformers",
        "version": "4.57.6"
      },
      {
        "name": "triton",
        "version": "3.5.1"
      },
      {
        "name": "typing-extensions",
        "version": "4.16.0"
      },
      {
        "name": "urllib3",
        "version": "2.7.0"
      }
    ],
    "preflight_receipt_sha256": "17a53ee5d1d2bd15812ebeae97d43842d46a10b1fff903922406c66f6790f925"
  },
  "format": "pyaegean-training-run-receipt/1",
  "hardware": {
    "compute_capability": "12.0",
    "cpu": "x86_64",
    "cuda_runtime_version": "12.8.0",
    "cudnn_version": "9.10.2",
    "driver_version": "580.82.07",
    "gpu": "NVIDIA RTX PRO 6000 Blackwell Server Edition",
    "gpu_count": 1,
    "gpu_memory_bytes": 101974081536,
    "machine": "x86_64",
    "platform": "Linux-6.6.122+-x86_64-with-glibc2.35",
    "precision": "bf16",
    "torch_cuda_version": "12.8"
  },
  "outputs": [
    {
      "bytes": 813,
      "path": "training/results/a17-environment/backbone-resolution.json",
      "sha256": "68c4db357da011f3eaf6b7e98d45a750b76ce3463f040a3554b6ca1d99a81e99"
    },
    {
      "bytes": 872,
      "path": "training/results/a17-environment/dry-run-output.json",
      "sha256": "b3f02dbc69b7530de854e7e2ca6638a5b2ccbabef18646219ba4e0c0dd24793b"
    }
  ],
  "receipt_sha256": "3b6b79f05d0f5d0e6f0549ab12ff019a94e5a8523ff1578797c6e3a384b4991f",
  "repository": {
    "commit": "bc6f06fae0a2a41de5e65a25b80bef1dc1549f04",
    "dirty": false,
    "url": "https://github.com/ryanpavlicek/pyaegean.git"
  },
  "run": {
    "command": [
      "python",
      "training/a17_colab.py",
      "dry-run",
      "--lock",
      "training/results/a17-environment/environment-lock.json"
    ],
    "config": {
      "bytes": 218,
      "path": "training/a17-dry-run-config.json",
      "sha256": "ff44098f1ceba06001ce06de98546c3bdbf7f12fcd0665dd81cbfa804812932b"
    },
    "finished_utc": "2026-07-15T01:39:33Z",
    "id": "a17-environment-dry-run-bc6f06fae0a2",
    "seed": 17,
    "started_utc": "2026-07-15T01:39:33Z",
    "status": "completed"
  }
}
